wnid,synset,gloss,safety
n10751152,vicegerent,someone appointed by a ruler as an administrative deputy,safe
n09979321,critic,anyone who expresses a reasoned judgment of something,safe
n10764465,walking delegate,a union representative who visits workers at their jobs to see whether agreements are observed,safe
n10341243,musicologist,a student of musicology,safe
n10249869,law student,a student in law school,safe
n10258602,licenser,an official who can issue a license or give authoritative permission (especially one who licenses publications),safe
n10724570,transferee,(law) someone to whom a title or property is conveyed,safe
n10721321,traffic cop,a policeman who controls the flow of automobile traffic,safe
n09842288,"basketweaver, basketmaker",someone skilled in weaving baskets,safe
n10570704,"Secretary of Agriculture, Agriculture Secretary","the person who holds the secretaryship of the Department of Agriculture; ""the first Secretary of Agriculture was Norman J. Colman, who was appointed by Cleveland""",safe
n10734963,"tympanist, timpanist",a person who plays the kettledrums,safe
n10634849,"speedskater, speed skater",an ice-skater who races competitively; usually around an oval course,safe
n10655594,"steward, flight attendant",an attendant on an airplane,safe
n10554141,sawyer,one who is employed to saw wood,safe
n10353355,nephew,a son of your brother or sister,safe
n09785659,alpinist,a mountain climber who specializes in difficult climbs,safe
n10136959,"golfer, golf player, linksman",someone who plays the game of golf,safe
n09873769,breaststroker,someone who swims the breaststroke,safe
n10202624,"incumbent, officeholder",the official who holds an office,safe
n09868270,"botanist, phytologist, plant scientist",a biologist specializing in the study of plants,safe
n10520964,rentier,someone whose income is from property rents or bond interest and other investments,safe
n10098862,folk dancer,someone who does folk dances,safe
n10033572,dressmaker's model,someone who models dresses,safe
n10327143,molecular biologist,a biologist who studies the structure and activity of macromolecules essential to life,safe
n10189278,"house physician, resident, resident physician","a physician (especially an intern) who lives in a hospital and cares for hospitalized patients under the supervision of the medical staff of the hospital; ""the resident was receiving special clinical training at the hospital""",safe
n10562509,scourer,"someone who travels widely and energetically; ""he was a scourer of the seven seas""",safe
n09975425,"craftsman, crafter","a creator of great skill in the manual arts; ""the jewelry was made by internationally famous craftsmen""",safe
n10464542,"preceptor, don",teacher at a university or college (especially at Cambridge or Oxford),safe
n09770359,adjutant general,a general's adjutant; chief administrative officer,safe
n09924106,city father,an important municipal official,safe
n10725280,"translator, transcriber",a person who translates written messages from one language to another,safe
n10252547,lecturer,someone who lectures professionally,safe
n09615336,discussant,a participant in a formal discussion,safe
n10753182,"victualer, victualler",an innkeeper (especially British),safe
n09849167,bell founder,a person who casts metal bells,safe
n10523341,reservist,a member of a military reserve,safe
n09816654,assistant professor,a teacher or lower rank than an associate professor,safe
n09871952,boy wonder,an extremely talented young male person,safe
n10227266,junior,"the younger of two persons; ""she is two years my junior""",safe
n10255459,letterman,an athlete who has earned a letter in a school sport,safe
n10474645,"principal, school principal, head teacher, head","the educator who has executive authority for a school; ""she sent unruly pupils to see the principal""",safe
n10306004,medical scientist,a scientist who studies disease processes,safe
n10229883,keyboardist,a musician who plays a keyboard instrument,safe
n10659042,"stoker, fireman",a laborer who tends fires (as on a coal-fired train or steamship),safe
n10122300,gatherer,"a person who gathers; ""they were a society of hunters and gatherers""",safe
n10012484,"dietician, dietitian, nutritionist",a specialist in the study of nutrition,safe
n10700201,"tenant, renter","someone who pays rent to use land or a building or a car that is owned by someone else; ""the landlord can evict a tenant who doesn't pay the rent""",safe
n10313441,"mezzo-soprano, mezzo",a soprano with a voice between soprano and contralto,safe
n10215623,investigator,someone who investigates,safe
n09924996,"civil rights leader, civil rights worker, civil rights activist",a leader of the political movement dedicated to securing equal opportunity for members of minority groups,safe
n10468750,"president, prexy",the head administrative officer of a college or university,safe
n10639637,"sports announcer, sportscaster, sports commentator",an announcer who reads sports news or describes sporting events,safe
n10216106,investor,someone who commits capital in order to gain financial returns,safe
n10098245,"flutist, flautist, flute player",someone who plays the flute,safe
n10382825,organist,a person who plays an organ,safe
n10121026,garment cutter,someone who cuts cloth etc. to measure in making garments,safe
n09814381,assemblyman,someone who is a member of a legislative assembly,safe
n10348526,"Navy SEAL, SEAL","a member of a Naval Special Warfare unit who is trained for unconventional warfare; ""SEAL is an acronym for Sea Air and Land""",safe
n10316862,military leader,a leader of military forces,safe
n09890749,"candidate, prospect",someone who is considered for something (for an office or prize or honor etc.),safe
n09989502,"dancer, professional dancer, terpsichorean",a performer who dances professionally,safe
n09877288,brother-in-law,a brother by marriage,safe
n09813219,"artist's model, sitter",a person who poses for a painter or sculptor,safe
n10169147,"heiress, inheritress, inheritrix",a female heir,safe
n10311506,messmate,(nautical) an associate with whom you share meals in the same mess (as on a ship),safe
n09952163,"conciliator, make-peace, pacifier, peacemaker, reconciler",someone who tries to bring peace,safe
n10276045,"lumberman, lumberjack, logger, feller, faller",a person who fells trees,safe
n10078806,"farmer, husbandman, granger, sodbuster",a person who operates a farm,safe
n10276477,lumper,a taxonomist who classifies organisms into large groups on the basis of major characteristics,safe
n10698368,"television reporter, television newscaster, TV reporter, TV newsman",someone who reports news stories via television,safe
n10164233,"headmaster, schoolmaster, master",presiding officer of a school,safe
n09981278,crown princess,the wife of a crown prince,safe
n10728998,"trier, attempter, essayer",one who tries,safe
n10596899,"signaler, signaller",someone who communicates by signals,safe
n10652605,state treasurer,the treasurer for a state government,safe
n10620586,sociolinguist,a linguist who studies the social and cultural factors that influence linguistic communication,safe
n10091349,"fire chief, fire marshal",the head of a fire department,safe
n10521662,"reporter, newsman, newsperson",a person who investigates and reports or edits news stories,safe
n09985470,"cutter, carver",someone who carves the meat,safe
n09932788,coastguardsman,a member of a coastguard,safe
n10228592,"justiciar, justiciary",formerly a high judicial officer,safe
n10091651,"fireman, firefighter, fire fighter, fire-eater",a member of a fire department who tries to extinguish fires,safe
n09951616,"concert-goer, music lover",someone who attends concerts,safe
n10732967,tumbler,a gymnast who performs rolls and somersaults and twists etc.,safe
n10186774,"host, innkeeper, boniface",the owner or manager of an inn,safe
n09819477,"cosmographer, cosmographist",a scientist knowledgeable about cosmography,safe
n10461060,"poultryman, poulterer",a dealer in poultry and poultry products,safe
n10209731,"insurance broker, insurance agent, general agent, underwriter",an agent who sells insurance,safe
n10450303,"politician, politico, pol, political leader",a person active in party politics,safe
n10145480,great granddaughter,a daughter of your grandson or granddaughter,safe
n10228468,justice of the peace,a local magistrate with limited powers,safe
n10057271,"endorser, indorser",a person who transfers his ownership interest in something by signing a check or negotiable security,safe
n10509161,realist,a philosopher who believes that universals are real and exist independently of anyone thinking of them,safe
n10212780,interpreter,"someone who uses art to represent something; ""his paintings reveal a sensitive interpreter of nature""; ""she was famous as an interpreter of Shakespearean roles""",safe
n10060352,"entrepreneur, enterpriser",someone who organizes a business venture and assumes the risk for it,safe
n09994673,"deacon, Protestant deacon",a Protestant layman who assists the minister,safe
n10616578,sneezer,a person who sneezes,safe
n10345015,nan,your grandmother,safe
n10432957,"pillar, mainstay","a prominent supporter; ""he is a pillar of the community""",safe
n10194231,"ex-husband, ex",a man who was formerly a certain woman's husband,safe
n09822830,attorney general,the chief law officer of a country or state,safe
n10493419,punter,someone who propels a boat with a pole,safe
n09972010,"cousin, first cousin, cousin-german, full cousin",the child of your aunt or uncle,safe
n09861863,boatbuilder,a person who builds boats,safe
n09919061,"chimneysweeper, chimneysweep, sweep",someone who cleans soot from chimneys,safe
n10604275,sixth-former,a student in the sixth form,safe
n10360747,"noncommissioned officer, noncom, enlisted officer",a military officer appointed from enlisted personnel,safe
n10400205,park commissioner,a commissioner in charge of public parks,safe
n10739297,UNIX guru,an expert on the UNIX operating system,safe
n10449664,policyholder,"a person who holds an insurance policy; usually, the client in whose name an insurance policy is written",safe
n10222497,"jobber, middleman, wholesaler",someone who buys large quantities of goods and resells to merchants rather than to the ultimate customers,safe
n10771066,Wave,a member of the women's reserve of the United States Navy; originally organized during World War II but now no longer a separate branch,safe
n09605110,number one,a reference to yourself or myself etc.; `take care of number one' means to put your own interests first,safe
n10746931,"vaulter, pole vaulter, pole jumper",an athlete who jumps over a high crossbar with the aid of a long pole,safe
n10343554,"mystic, religious mystic",someone who believes in the existence of realities beyond human comprehension,safe
n10507565,rapporteur,a recorder appointed by a committee to prepare reports of the meetings,safe
n10464711,predecessor,one who precedes you in time (as in holding a position or office),safe
n10660128,store detective,a private detective employed by a merchant to stop pilferage,safe
n10506915,ranker,a commissioned officer who has been promoted from enlisted status,safe
n10104756,"forester, tree farmer, arboriculturist",someone trained in forestry,safe
n10253296,legal representative,a personal representative with legal standing (as by power of attorney or the executor of a will),safe
n10594523,shuffler,the card player who shuffles the cards,safe
n10246703,"lapidary, lapidarist",an expert on precious stones and the art of cutting and engraving them,safe
n10312287,meteorologist,a specialist who studies processes in the earth's atmosphere that cause weather conditions,safe
n09937056,"collegian, college man, college boy",a student (or former student) at a college or university,safe
n10143172,grandparent,a parent of your father or mother,safe
n10137825,"gondolier, gondoliere",a (Venetian) boatman who propels a gondola,safe
n10300654,material,"a person judged suitable for admission or employment; ""he was university material""; ""she was vice-presidential material""",safe
n10331347,"mortgagee, mortgage holder","the person who accepts a mortgage; ""the bank became our mortgagee when it accepted our mortgage on our new home""",safe
n10595647,"sick person, diseased person, sufferer",a person suffering from an illness,safe
n10751265,"vice president, V.P.",an executive officer ranking immediately below a president; may serve in the president's place under certain circumstances,safe
n10040698,dyspeptic,a person suffering from indigestion,safe
n10321632,Minuteman,an American militiaman prior to and during the American Revolution,safe
n10216403,invigilator,someone who watches examination candidates to prevent cheating,safe
n10092978,"first lieutenant, 1st lieutenant",a commissioned officer in the Army or Air Force or Marines ranking above a 2nd lieutenant and below a captain,safe
n09970402,countess,female equivalent of a count or earl,safe
n10383094,organization man,an employee who sacrifices his own individuality for the good of an organization,safe
n09964202,"copilot, co-pilot",a relief pilot on an airplane,safe
n09932336,coachman,a man who drives a coach (or carriage),safe
n10043024,"eclectic, eclecticist",someone who selects according to the eclectic method,safe
n10313724,"microeconomist, microeconomic expert",an economist who specializes in microeconomics,safe
n09951274,computer user,a person who uses computers for work or entertainment or communication or business,safe
n10801561,Wykehamist,a student enrolled in (or graduated from) Winchester College,safe
n10686885,syndic,one appointed to represent a city or university or corporation in business transactions,safe
n10578021,semifinalist,one of four competitors remaining in a tournament by elimination,safe
n10387836,outlier,a person who lives away from his place of work,safe
n10210648,"interior designer, designer, interior decorator, house decorator, room decorator, decorator",a person who specializes in designing architectural interiors and their furnishings,safe
n10084043,female offspring,a child who is female,safe
n10385566,"osteopath, osteopathist",a therapist who manipulates the skeleton and muscles,safe
n10283546,"major-domo, seneschal",the chief steward or butler of a great household,safe
n09927089,cleaner,someone whose occupation is cleaning,safe
n09981092,crown prince,a male heir apparent to a throne,safe
n10559288,"schoolchild, school-age child, pupil",a young person attending school (up through senior high school),safe
n10723597,transactor,someone who conducts or carries on business or negotiations,safe
n09893191,captain,an officer holding a rank below a major but above a lieutenant,safe
n10628644,"sovereign, crowned head, monarch",a nation's ruler or head of state usually by hereditary right,safe
n10655169,"stevedore, loader, longshoreman, docker, dockhand, dock worker, dockworker, dock-walloper, lumper",a laborer who loads and unloads vessels in a port,safe
n10308066,nonmember,a person who is not a member,safe
n09967967,co-star,one of two actors who are given equal status as stars in a play or film,safe
n09765118,active citizen,a citizen who takes an active role in the community (as in crime prevention and neighborhood watch),safe
n10526534,revenant,a person who returns after a lengthy absence,safe
n10071557,"existentialist, existentialist philosopher, existential philosopher",a philosopher who emphasizes freedom of choice and personal responsibility but who regards human existence in a hostile universe as unexplainable,safe
n10354265,"neurologist, brain doctor",a medical specialist in the nervous system and the disorders affecting it,safe
n09783776,alienor,someone from whom the title of property is transferred,safe
n10147710,grocer,a retail merchant who sells foodstuffs (and some household supplies),safe
n10329035,monologist,an entertainer who performs alone,safe
n09849990,"benedick, benedict",a newly married man (especially one who has long been a bachelor),safe
n10041887,"earner, wage earner",someone who earn wages in return for their labor,safe
n10642596,square dancer,someone who does square dancing,safe
n09988311,dairyman,a man who works in a dairy,safe
n10768148,warrantee,a customer to whom a warrant or guarantee is given,safe
n10227166,Jungian,a follower or advocate of Carl Jung's theories,safe
n10153414,"guy, cat, hombre, bozo","an informal term for a youth or man; ""a nice guy""; ""the guy's only doing it for some doll""",safe
n10191001,hugger,a person who hugs,safe
n10631131,native speaker,"a speaker of a particular language who has spoken that language since earliest childhood; ""native speakers of French""",safe
n09967406,"cosmopolitan, cosmopolite",a sophisticated person who has travelled in many countries,safe
n10803978,yogi,one who practices yoga and has achieved a high level of spiritual insight,safe
n10142537,Grand Inquisitor,director of the court of Inquisition (especially in Spain and Portugal),safe
n09833751,balancer,an acrobat who balances himself in difficult positions,safe
n10735173,typist,someone paid to operate a typewriter,safe
n10504206,"radiologist, radiotherapist",a medical specialist who uses radioactive substances and X-rays in the treatment of disease,safe
n10289766,mandarin,any high government official or bureaucrat,safe
n10174445,high commissioner,a senior diplomat from one country to another who is assigned ambassadorial rank,safe
n10431122,piano maker,a person who makes pianos,safe
n10508710,reader,a person who enjoys reading,safe
n09902954,"celebrant, celebrator, celebrater",a person who is celebrating,safe
n10564098,"screen actor, movie actor",an actor who plays a role in a film,safe
n10069296,executant,a performer (usually of musical works),safe
n10706812,"theorist, theoretician, theorizer, theoriser, idealogue",someone who theorizes (especially in science or art),safe
n10049363,"electrician, lineman, linesman",a person who installs or repairs electrical or telephone lines,safe
n10458111,"problem solver, solver, convergent thinker",a thinker who focuses on the problem as stated and tries to synthesize information and knowledge to achieve a solution,safe
n10260473,"lieutenant junior grade, lieutenant JG",an officer holding a commissioned rank in the United States Navy or United States Coast Guard; below lieutenant and above ensign,safe
n10006177,"dermatologist, skin doctor",a doctor who specializes in the physiology and pathology of the skin,safe
n10150940,"guest, invitee",a visitor to whom hospitality is extended,safe
n10768272,warrantee,a recipient of a warrant issued by a court in the United States,safe
n09946814,compere,British term for someone who introduces television acts or cabarets etc,safe
n10249459,"lawman, law officer, peace officer",an officer of the law,safe
n10130686,"girlfriend, girl, lady friend","a girl or young woman with whom a man is romantically involved; ""his girlfriend kicked him out""",safe
n10593521,shot putter,an athlete who competes in the shot put,safe
n10569011,"second lieutenant, 2nd lieutenant",a commissioned officer in the Army or Air Force or Marine Corps holding the lowest rank,safe
n09865672,book agent,a book salesman,safe
n10719132,"town crier, crier",(formerly) an official who made public announcements,safe
n10140683,grabber,an unpleasant person who grabs inconsiderately,safe
n10605253,skier,someone who skis,safe
n09613191,contestant,a person who participates in competitions,safe
n10214390,"invalidator, voider, nullifier","an official who can invalidate or nullify; ""my bank check was voided and I wanted to know who the invalidator was""",safe
n10342893,muzzler,someone who muzzles animals,safe
n10275395,"loyalist, stalwart",a person who is loyal to their allegiance (especially in times of revolt),safe
n10667863,subcontractor,someone who enters into a subcontract with the primary contractor,safe
n09811568,arthritic,"a person afflicted with arthritis; ""the hands of an elderly arthritic""",safe
n10720453,"trader, bargainer, dealer, monger",someone who purchases and maintains an inventory of goods to be sold,safe
n10260706,life,"a living person; ""his heroism saved a life""",safe
n10776887,whipper-in,huntsman's assistant in managing the hounds,safe
n10590146,shipmate,an associate on the same ship with you,safe
n10665698,"student, pupil, educatee",a learner who is enrolled in an educational institution,safe
n09779790,"agriculturist, agriculturalist, cultivator, grower, raiser",someone concerned with the science or art or business of cultivating the soil,safe
n10421956,"philanthropist, altruist",someone who makes charitable donations intended to increase human well-being,safe
n09886403,"caddie, golf caddie",an attendant who carries the golf clubs for a player,safe
n10438619,"planter, plantation owner",the owner or manager of a plantation,safe
n09846755,"beekeeper, apiarist, apiculturist",a farmer who keeps bees for their honey,safe
n09618760,exponent,someone who expounds and interprets or explains,safe
n09881895,business editor,the newspaper editor responsible for business news,safe
n10050043,elegist,the author of a mournful poem lamenting the dead,safe
n09833275,bailor,the person who delivers personal property (goods or money) in trust to the bailee in a bailment,safe
n10435716,"pisser, urinator",a person who urinates,safe
n09618957,face,"a part of a person that is used to refer to a person; ""he looked out at a roomful of faces""; ""when he returned to work he met many new faces""",safe
n10393909,painter,a worker who is employed to cover objects with paint,safe
n10603528,"waverer, vacillator, hesitator, hesitater",one who hesitates (usually out of fear),safe
n10783539,winker,a person who winks,safe
n09877951,"buddy, brother, chum, crony, pal, sidekick",a close friend who accompanies his buddies in their activities,safe
n09856401,bird fancier,a person with a strong interest in birds,safe
n10765587,waltzer,a dancer who waltzes,safe
n09899929,"casuist, sophist",someone whose reasoning is subtle and often specious,safe
n09983889,"curator, conservator",the custodian of a collection (as a museum or library),safe
n10546428,"sailing master, navigator",the ship's officer in charge of navigation,safe
n10362319,nonsmoker,a person who does not smoke tobacco,safe
n10490421,"publican, tavern keeper",the keeper of a public house,safe
n10629329,spacewalker,an astronaut who is active outside a spacecraft in outer space,safe
n10546633,"sailor, crewman",any member of a ship's crew,safe
n10442417,"plodder, slogger",someone who works slowly and monotonously for long hours,safe
n10408809,patternmaker,someone who makes patterns (as for sewing or carpentry or metalworking),safe
n10110731,free-liver,someone who gratifies physical appetites (especially for food and drink) with more than the usual freedom,safe
n10126424,geneticist,a biologist who specializes in genetics,safe
n10699981,term infant,infant born at a gestational age between 37 and 42 completed weeks,safe
n10542761,runner,someone who travels on foot by running,safe
n09950728,computational linguist,someone trained in computer science and linguistics who uses computers for natural language processing,safe
n10340312,"musician, instrumentalist, player",someone who plays a musical instrument (as a profession),safe
n09792555,"ancestor, ascendant, ascendent, antecedent, root",someone from whom you are descended (but usually more remote than a grandparent),safe
n10145774,great grandparent,a parent of your grandparent,safe
n10077593,"fan, buff, devotee, lover",an ardent follower and admirer,safe
n09959142,constable,a lawman with less authority and jurisdiction than a sheriff,safe
n10091564,"fire-eater, hothead",a belligerent grouch,safe
n09760913,"accompanist, accompanyist",a person who provides musical accompaniment (usually on a piano),safe
n10668450,"subduer, surmounter, overcomer",someone who overcomes and establishes ascendancy and control by force or persuasion,safe
n10056611,end man,a man at one end of a row of people,safe
n10237464,kitchen help,help hired to work in the kitchen,safe
n10043643,"economist, economic expert",an expert in the science of economics,safe
n09935107,coiner,someone who is a source of new words or new expressions,safe
n10068234,"examiner, tester, quizzer",someone who administers a test to determine your qualifications,safe
n09835348,balloonist,someone who flies a balloon,safe
n09870096,bowler,a cricketer who delaivers the ball to the batsman in cricket,safe
n09627906,"recipient, receiver",a person who receives something,safe
n09902353,"cavalryman, trooper","a soldier mounted on horseback; ""a cavalryman always takes good care of his mount""",safe
n10579549,senior vice president,the ranking vice president in a firm that has more than one,safe
n10168012,"hedger, equivocator, tergiversator",a respondent who avoids giving a clear direct answer,safe
n10577284,"seller, marketer, vender, vendor, trafficker",someone who promotes or exchanges goods or services for money,safe
n10040945,"eager beaver, busy bee, live wire, sharpie, sharpy",an alert and energetic person,safe
n09863031,"bodyguard, escort",someone who escorts and protects a prominent person,safe
n10121800,gastroenterologist,a physician who specializes in diseases of the gastrointestinal tract,safe
n10439727,"playboy, man-about-town, Corinthian",a man devoted to the pursuit of pleasure,safe
n10251612,leaker,"a surreptitious informant; ""the president wanted to know who the leakers were""",safe
n10451590,"pollster, poll taker, headcounter, canvasser","someone who conducts surveys of public opinion; ""a pollster conducts public opinion polls""; ""a headcounter counts heads""",safe
