wnid,synset,gloss,safety
n10009484,detective,an investigator engaged or employed in obtaining information not easily available to the public,sensitive
n10319313,minder,"someone (usually in totalitarian countries) who is assigned to watch over foreign visitors; ""I turned around and there, a few hundred feet away, was our government minder, Li Wong Su, huffing and puffing toward us""",sensitive
n09710886,Dorian,a member of one of four linguistic divisions of the prehistoric Greeks,sensitive
n09706255,Komi,a member of a Finnish people living in the northwestern Urals in Russia,sensitive
n10778711,Augustinian,a Roman Catholic friar or monk belonging to one of the Augustinian monastic orders,sensitive
n10544232,rustic,an unsophisticated country person,sensitive
n10762480,Wagnerian,a follower of the theories or an admirer of the music of Richard Wagner,sensitive
n10217208,irreligionist,someone who is indifferent or hostile to religion,sensitive
n10310783,Mesoamerican,a member of one of the various peoples inhabiting Mesoamerica,sensitive
n09638454,mulatto,an offspring of a black and a white parent,sensitive
n09752023,Zulu,a member of the tall Negroid people of eastern South Africa; some live in KwaZulu-Natal under the traditional clan system but many now work in the cities,sensitive
n10178216,"hitter, striker","someone who hits; ""a hard hitter""; ""a fine striker of the ball""; ""blacksmiths are good hitters""",sensitive
n10711766,Timorese,a native or inhabitant of Timor,sensitive
n09968741,"cotter, cottar",a peasant farmer in the Scottish Highlands,sensitive
n10791890,worldling,a person absorbed by the concerns and interests and pleasures of the present world,sensitive
n10220080,"Javanese, Javan",a native or inhabitant of Java,sensitive
n09957523,Conservative,a member of a Conservative Party,sensitive
n09676021,Kashmiri,a member of the people of Kashmir,sensitive
n10235269,King's Counsel,Counsel to the Crown when the British monarch is a king,sensitive
n09862621,bobby,an informal term for a British policeman,sensitive
n09709673,Creole,a person of European descent born in the West Indies or Latin America,sensitive
n10703480,testatrix,a female testator,sensitive
n10731732,"truant, hooky player",one who is absent from school without permission,sensitive
n10286282,malik,"the leader of a town or community in some parts of Asia Minor and the Indian subcontinent; ""maliks rule the hinterland of Afghanistan under the protection of warlords""",sensitive
n10262880,lilliputian,a very small person (resembling a Lilliputian),sensitive
n10586998,Shavian,an admirer of G. B. Shaw or his works,sensitive
n10025391,Donatist,an adherent of Donatism,sensitive
n09959658,constructivist,an artist of the school of constructivism,sensitive
n09710041,Gabonese,a native or inhabitant of Gabon,sensitive
n10745770,valley girl,a girl who grew up in the tract housing in the San Fernando Valley,sensitive
n10527147,revisionist,a Communist who tries to rewrite Marxism to justify a retreat from the revolutionary position,sensitive
n10289176,man,"a male subordinate; ""the chief stationed two men outside the building""; ""he awaited word from his man in Havana""",sensitive
n10347204,nautch girl,a professional dancing girl in India,sensitive
n10218292,Jacksonian,a follower of Andrew Jackson or his ideas,sensitive
n10311661,mestiza,a woman of mixed racial ancestry (especially mixed European and Native American ancestry),sensitive
n10312600,Methodist,a follower of Wesleyanism as practiced by the Methodist Church,sensitive
n10625860,"sorcerer, magician, wizard, necromancer, thaumaturge, thaumaturgist",one who practices magic or sorcery,sensitive
n10572706,Secretary of State,"the person who holds the secretaryship of the Department of State; ""the first Secretary of State was Thomas Jefferson""",sensitive
n10432189,"picnicker, picknicker",a person who is picnicking,sensitive
n09714120,Icelander,a native or inhabitant of Iceland,sensitive
n10173771,Herr,a German man; used before the name as a title equivalent to Mr in English,sensitive
n10505347,rainmaker,American Indian medicine man who attempt to make it rain,sensitive
n10279778,madame,title used for a married Frenchwoman,sensitive
n10038409,duchess,the wife of a duke or a woman holding ducal title in her own right,sensitive
n09740724,Anglo-American,an American who was born in Britain or one whose ancestors were British,sensitive
n10368711,nympholept,a person seized by nympholepsy,sensitive
n10195056,hyperope,a person with hyperopia; a farsighted person,sensitive
n09708750,Parisian,a native or resident of Paris,sensitive
n10776339,"whiner, complainer, moaner, sniveller, crybaby, bellyacher, grumbler, squawker",a person given to excessive complaints and crying and whining,sensitive
n09745229,"Oregonian, Beaver",a native or resident of Oregon,sensitive
n10001481,"demagogue, demagog, rabble-rouser",a political leader who seeks support by appealing to popular passions and prejudices,sensitive
n10140597,governor general,a governor of high rank,sensitive
n10127186,gent,informal abbreviation of `gentleman',sensitive
n10528493,"rhymer, rhymester, versifier, poetizer, poetiser",a writer who composes rhymes; a maker of poor verses (usually used as terms of contempt for minor or inferior poets),sensitive
n09653144,"Cocopa, Cocopah",a member of a North American Indian people living around the mouth of the Colorado River,sensitive
n10521853,newswoman,a female newsperson,sensitive
n09758173,"abstainer, ascetic",someone who practices self denial as a spiritual discipline,sensitive
n09826821,ayah,(in India) a native nursemaid who looks after children,sensitive
n10465831,presbyter,an elder in the Presbyterian Church,sensitive
n10104487,foreman,a man who is foreperson of a jury,sensitive
n10154601,"hack, drudge, hacker",one who works hard at boring tasks,sensitive
n10195593,"hypocrite, dissembler, dissimulator, phony, phoney, pretender",a person who professes beliefs and opinions that he or she does not hold in order to conceal his or her real feelings or motives,sensitive
n10157128,halfback,(football) the running back who plays the offensive halfback position,sensitive
n10740868,"upstart, parvenu, nouveau-riche, arriviste",a person who has suddenly risen to a higher economic status but has not gained social acceptance of others in that class,sensitive
n10618848,socialist,a political advocate of socialism,sensitive
n09703708,Cantabrigian,a resident of Cambridge,sensitive
n09934337,cog,"a subordinate who performs an important but routine function; ""he was a small cog in a large machine""",sensitive
n10436334,pitchman,an aggressive salesman who uses a fast line of talk to sell something,sensitive
n09686262,Eurafrican,a person of mixed European and African descent,sensitive
n10645017,staff sergeant,a noncommissioned officer ranking above corporal and below sergeant first class in the Army or Marines or above airman 1st class in the Air Force,sensitive
n10458356,pro-lifer,an advocate of full legal protection for embryos and fetuses; someone opposed to legalized induced abortion,sensitive
n09824135,"authoritarian, dictator","a person who behaves in a tyrannical manner; ""my boss is a dictator who makes everyone work overtime""",sensitive
n10020533,"ex-wife, ex","a woman who was formerly a particular man's wife; ""all his exes live in Texas""",sensitive
n10699752,tempter,"a person who tempts others; ""Satan is the great tempter of mankind""",sensitive
n09726811,"Carib, Carib Indian",a member of an American Indian peoples of northeastern South America and the Lesser Antilles,sensitive
n09863936,"Bolshevik, Bolshevist",a Russian member of the left-wing majority group that followed Lenin and eventually became the Russian communist party,sensitive
n09827246,"babu, baboo",used as a Hindi courtesy title; equivalent to English `Mr',sensitive
n09993252,"dawdler, drone, laggard, lagger, trailer, poke",someone who takes more time than necessary; someone who lags behind,sensitive
n10018747,distortionist,a painter who introduces distortions,sensitive
n10025060,"dominus, dominie, domine, dominee",a clergyman; especially a settled minister or parson,sensitive
n10375052,old boy,a vivacious elderly man,sensitive
n10336904,muffin man,formerly an itinerant peddler of muffins,sensitive
n10167361,heavy,an actor who plays villainous roles,sensitive
n09778927,agnostic,a person who claims that they cannot have true knowledge about the existence of God (but does not deny that God might exist),sensitive
n10772580,weekend warrior,a reservist who fulfills the military obligation on weekends,sensitive
n09620794,"native, indigen, indigene, aborigine, aboriginal","an indigenous person who was born in a particular place; ""the art of the natives of the northwest coast""; ""the Canadian government scrapped plans to tax the grants to aboriginal college students""",sensitive
n10181445,homeboy,a male friend from your neighborhood or hometown,sensitive
n10062492,equerry,a personal attendant of the British royal family,sensitive
n09685233,Hare Krishna,worshipper of Krishna and member of the International Society for Krishna Consciousness,sensitive
n10602985,"sister, sis","a female person who has the same parents as another person; ""my sister married a musician""",sensitive
n09613118,contadino,an Italian farmer,sensitive
n10101981,footman,a man employed as a servant in a large establishment (as a palace) to run errands and do chores,sensitive
n09750891,"Yugoslav, Jugoslav, Yugoslavian, Jugoslavian",a native or inhabitant of Yugoslavia,sensitive
n10134760,godfather,any man who serves as a sponsor for a child at baptism,sensitive
n10580437,septuagenarian,someone whose age is in the seventies,sensitive
n10092643,"firstborn, eldest",the offspring who came first in the order of birth,sensitive
n10712690,"tippler, social drinker",someone who drinks liquor repeatedly in small quantities,sensitive
n09699020,"Cypriot, Cypriote, Cyprian",a native or inhabitant of Cyprus,sensitive
n09892262,capitalist,a conservative advocate of capitalism,sensitive
n09698644,Congolese,a native or inhabitant of the Republic of the Congo,sensitive
n10374943,old-age pensioner,an old person who receives an old-age pension,sensitive
n10384392,orphan,a child who has lost both parents,sensitive
n09901786,Catholicos,the ecclesiastical title of the leaders of the Nestorian and Armenian churches,sensitive
n10295371,marquess,a British peer ranking below a duke and above an earl,sensitive
n10691318,"tapper, wiretapper, phone tapper",someone who wiretaps a telephone or telegraph wire,sensitive
n09660010,Malecite,a member of the Algonquian people of northeastern Maine and New Brunswick,sensitive
n09668562,Shawnee,a member of the Algonquian people formerly living along the Tennessee river,sensitive
n09988063,"dad, dada, daddy, pa, papa, pappa, pop",an informal term for a father; probably derived from baby talk,sensitive
n10240821,Kshatriya,a member of the royal or warrior Hindu caste,sensitive
n09726621,South American Indian,a member of a native Indian group in South America,sensitive
n09692915,Herero,"a member of a pastoral Bantu people living in Namibia, Botswana, and Angola",sensitive
n10294020,margrave,the military governor of a frontier province in medieval Germany,sensitive
n09910556,chartered accountant,a British or Canadian accountant who is a member of a professional body that has a royal charter,sensitive
n09665367,Penobscot,a member of the Algonquian people belonging to the Abnaki confederacy and living in the Penobscot valley in northern Maine,sensitive
n09672725,Yavapai,a member of a North American Indian people of central Arizona,sensitive
n10349750,Nazarene,an early name for any Christian,sensitive
n10373390,officiant,a clergyman who officiates at a religious ceremony or service,sensitive
n10077106,familiar,a person attached to the household of a high official (as a pope or bishop) who renders service in return for support,sensitive
n10117851,gal,alliterative term for girl (or woman),sensitive
n09746936,Uruguayan,a native or inhabitant of Uruguay,sensitive
n10333044,mother figure,a woman who evokes the feelings usually reserved for a mother,sensitive
n10410246,peacekeeper,a member of a military force that is assigned (often with international sanction) to preserve peace in a trouble area,sensitive
n09667358,Salish,a member of a group of North American Indians speaking a Salishan language and living on the northwest coast of North America,sensitive
n10152616,guru,a Hindu or Buddhist religious leader and spiritual teacher,sensitive
n10315456,Milanese,a native or inhabitant of Milan,sensitive
n09984960,customer agent,a foreign purchaser who buys goods outright for resale,sensitive
n09751895,Zimbabwean,a native or inhabitant of Zimbabwe,sensitive
n10083677,"fellow traveler, fellow traveller",a communist sympathizer (but not a member of the Communist Party),sensitive
n10597505,signer,someone who can use sign language to communicate,sensitive
n09830400,backbencher,a member of the House of Commons who is not a party leader,sensitive
n09889941,camper,someone living temporarily in a tent or lodge for recreation,sensitive
n10409459,pawnbroker,a person who lends money at interest in exchange for personal property that is deposited as security,sensitive
n10082423,"Fauve, fauvist",a member of a group of French painters who followed fauvism,sensitive
n10072054,"exorcist, exorciser",someone who practices exorcism,sensitive
n10417288,peshmerga,a member of a Kurdish guerilla organization that fights for a free Kurdish state,sensitive
n09762385,accuser,someone who imputes guilt or blame,sensitive
n09695019,Carioca,a native or inhabitant of Rio de Janeiro,sensitive
n10144338,"grass widower, divorced man",a man who is divorced from (or separated from) his wife,sensitive
n09748889,Ghanian,a native or inhabitant of Ghana,sensitive
n10588965,shepherd,a clergyman who watches over a group of people,sensitive
n09703932,Cornishwoman,a woman who is a native or resident of Cornwall,sensitive
n09731436,South African,a native or inhabitant of South Africa,sensitive
n09664556,"Paiute, Piute",a member of either of two Shoshonean peoples (northern Paiute and southern Paiute) related to the Aztecs and living in the southwestern United States,sensitive
n09751496,Xhosa,a member of the Negroid people of southern South Africa,sensitive
n10084295,"female child, girl, little girl","a youthful female person; ""the baby was a girl""; ""the girls were just learning to ride a tricycle""",sensitive
n09736945,Ugandan,a native or inhabitant of Uganda,sensitive
n09890192,camp follower,a follower who is not a member of an ingroup,sensitive
n09781650,albino,a person with congenital albinism: white hair and milky skin; eyes are usually pink,sensitive
n09956578,"conqueror, vanquisher",someone who is victorious by force of arms,sensitive
n10368528,"nymph, houri",a voluptuously beautiful young woman,sensitive
n10765679,"wanderer, roamer, rover, bird of passage",someone who leads a wandering unsettled life,sensitive
n10048367,elder,any of various church officers,sensitive
n10123122,gendarme,a French policeman,sensitive
n09994808,deaconess,a woman deacon,sensitive
n09715165,Irishman,a man who is a native or inhabitant of Ireland,sensitive
n10327987,"Monegasque, Monacan",a native or inhabitant of Monaco,sensitive
n10288964,adonis,any handsome young man,sensitive
n09737453,"Tungus, Evenk",a member of the Tungus speaking people of Mongolian race who are a nomadic people widely spread over eastern Siberia; related to the Manchu,sensitive
n09901337,catechist,one who instructs catechumens in preparation for baptism (especially one using a catechism),sensitive
n10119609,gamine,a girl of impish appeal,sensitive
n10113583,"front man, front, figurehead, nominal head, straw man, strawman",a person used as a cover for some questionable activity,sensitive
n09937903,"colonizer, coloniser",someone who helps to found a colony,sensitive
n10219453,janissary,"a loyal supporter; ""every politician has a following of janissaries""",sensitive
n10156831,Hakka,"a member of a people of southeastern China (especially Hong Kong, Canton, and Taiwan) who migrated from the north in the 12th century",sensitive
n09789566,amputee,someone who has had a limb removed by amputation,sensitive
n09877750,"Brummie, Brummy","a native or resident of Birmingham, England",sensitive
n10530959,"right-hander, right hander, righthander",a person who uses the right hand more skillfully than the left,sensitive
n10245029,landgrave,a count who had jurisdiction over a large territory in medieval Germany,sensitive
n10025635,donna,an Italian woman of rank,sensitive
n10366145,nullipara,(obstetrics) a woman who has never give birth to a child,sensitive
n09744679,New Yorker,a native or resident of New York (especially of New York City),sensitive
n10145590,great grandmother,a mother of your grandparent,sensitive
n09906449,chameleon,a changeable or inconstant person,sensitive
n09670521,Tarahumara,a member of the Taracahitian people of north central Mexico,sensitive
n09871867,boy scout,a man who is considered naive,sensitive
n10478293,proconsul,a provincial governor of consular rank in the Roman Republic and Roman Empire,sensitive
n10236521,"enate, matrikin, matrilineal kin, matrisib, matrilineal sib",one related on the mother's side,sensitive
n09971273,countrywoman,a woman who lives in the country and has country ways,sensitive
n09735258,Turki,any member of the peoples speaking a Turkic language,sensitive
n09649067,Olmec,a member of an early Mesoamerican civilization centered around Veracruz that flourished between 1300 and 400 BC,sensitive
n10247880,Latin,a person who is a member of those peoples whose languages derived from Latin,sensitive
n09744834,"North Carolinian, Tarheel",a native or resident of North Carolina,sensitive
n09724785,Nigerian,a native or inhabitant of Nigeria,sensitive
n10221520,Jesuit,a member of the Jesuit order,sensitive
n09656077,Havasupai,a member of a North American Indian people of Cataract Canyon in Arizona,sensitive
n09823502,"aunt, auntie, aunty",the sister of your father or mother; the wife of your uncle,sensitive
n09679170,gentile,a person who is not a member of one's own religion; used in this sense by Mormons and Hindus,sensitive
n10015792,dirty old man,a middle-aged man with lecherous inclinations,sensitive
n10248198,latitudinarian,a person who is broad-minded and tolerant (especially in standards of religious belief and conduct),sensitive
n10672371,Sufi,a Muslim who represents the mystical dimension of Islam; a Muslim who seeks direct experience of Allah; mainly in Iran,sensitive
n09712448,Haitian,a native or inhabitant of Haiti,sensitive
n10097842,flower girl,a young girl who carries flowers in a (wedding) procession,sensitive
n09744161,"Nebraskan, Cornhusker",a native or resident of Nebraska,sensitive
n10539278,Rosicrucian,a member of a secret 17th-century society of philosophers and scholars versed in mystical and metaphysical and alchemical lore,sensitive
n09670909,Tuscarora,a member of an Iroquois people who formerly lived in North Carolina and then moved to New York State and joined the Iroquois,sensitive
n10519494,religious leader,leader of a religious order,sensitive
n10612518,"slopseller, slop-seller",a dealer in cheap ready-made clothing,sensitive
n10755648,"Visayan, Bisayan",a member of the most numerous indigenous people of the Philippines,sensitive
n09709531,Creole,a person descended from French ancestors in southern United States (especially Louisiana),sensitive
n10335246,"mourner, griever, sorrower, lamenter",a person who is feeling grief (as grieving over someone who has died),sensitive
n10597889,signora,an Italian title of address equivalent to Mrs. when used before a name,sensitive
n09836519,matador,the principal bullfighter who is appointed to make the final passes and kill the bull,sensitive
n10061043,"envoy, envoy extraordinary, minister plenipotentiary",a diplomat having less authority than an ambassador,sensitive
n09826605,"aviatrix, airwoman, aviatress",a woman aviator,sensitive
n09762011,accused,a defendant in a criminal proceeding,sensitive
n10457214,poster girl,a female poster child,sensitive
n10158506,hand,"a member of the crew of a ship; ""all hands on deck""",sensitive
n10075299,eyewitness,a spectator who can describe what happened,sensitive
n09712967,Moro,a member of the predominantly Muslim people in the southern Philippines,sensitive
n10753339,"vigilante, vigilance man",member of a vigilance committee,sensitive
n10577182,self-starter,an energetic person with unusual initiative,sensitive
n10037922,"dry, prohibitionist",a reformer who opposes the use of intoxicating beverages,sensitive
n09774167,advisee,someone who receives advice,sensitive
n10599215,simperer,a smiler whose smile is silly and self-conscious and sometimes coy,sensitive
n09924195,city man,a financier who works in one of the banks in the City of London,sensitive
n10318293,"mill-hand, factory worker",a workman in a mill or factory,sensitive
n10508141,ratepayer,a person who pays local rates (especially a householder),sensitive
n10583790,settler,a clerk in a betting shop who calculates the winnings,sensitive
n10005934,deputy,a member of the lower chamber of a legislative assembly (such as in France),sensitive
n10690648,"tanker, tank driver",a soldier who drives a tank,sensitive
n10121714,gasman,someone employed by a gas company,sensitive
n09663786,Osage,a member of the Siouan people formerly living in Missouri in the valleys of the Missouri and Osage rivers; oil was found on Osage lands early in the 20th century,sensitive
n09720702,Levantine,(formerly) a native or inhabitant of the Levant,sensitive
n10037588,"Druze, Druse","an adherent of an esoteric monotheistic religious sect living in the relative security of the mountains of Syria and Lebanon who believes that Al-hakim was an incarnation of God; ""a Druze is permitted to conform outwardly to the faith of the unbelievers among whom he lives""",sensitive
n10187491,hostess,a woman host,sensitive
n09741074,"Alaska Native, Alaskan Native, Native Alaskan",a member or descendant of any of the aboriginal peoples of Alaska,sensitive
n09690496,Andorran,a native or inhabitant of Andorra,sensitive
n10433452,pilot,a person qualified to guide ships through difficult waters going into or out of a harbor,sensitive
n10563403,scrambler,"a rapid mover; someone who scrambles; ""their quarterback was a good scrambler""; ""scramblers can often unnerve a better tennis player""",sensitive
n09638875,"White, White person, Caucasian",a member of the Caucasoid race,sensitive
n10135297,"goffer, gopher",a zealously energetic person (especially a salesman),sensitive
n10552393,Sassenach,the Scots' term for an English person,sensitive
n10135197,gofer,an employee whose duties include running errands,sensitive
n10692090,Tarzan,(sometimes used ironically) a man of great strength and agility (after the hero of a series of novels by Edgar Rice Burroughs),sensitive
n09690621,Angolan,a native or inhabitant of Angola,sensitive
n09611722,conservator,someone appointed by a court to assume responsibility for the interests of a minor or incompetent person,sensitive
n09665545,Penutian,a member of a North American Indian people speaking one of the Penutian languages,sensitive
n09901502,"catechumen, neophyte",a new convert being taught the principles of Christianity by a catechist,sensitive
n09991740,dark horse,a political candidate who is not well known but could win unexpectedly,sensitive
n10787470,"woman, adult female","an adult female person (as opposed to a man); ""the woman kept house while the man hunted""",sensitive
n10522759,"rescuer, recoverer, saver",someone who saves something from danger or violence,sensitive
n10581890,"serjeant-at-law, serjeant, sergeant-at-law, sergeant",an English barrister of the highest rank,sensitive
n10193650,huntress,a woman hunter,sensitive
n09621232,native,"a person born in a particular place or country; ""he is a native of Brazil""",sensitive
n10161622,hash head,a user of hashish,sensitive
n10612373,sloganeer,someone who coins and uses slogans to promote a cause,sensitive
n10117415,"gagman, standup comedian",a comedian who uses gags,sensitive
n10712229,"tinkerer, fiddler",an unskilled person who tries to fix or mend,sensitive
n10211036,"interlocutor, middleman",the performer in the middle of a minstrel line who engages the others in talk,sensitive
n10471732,"prima donna, diva",a distinguished female operatic singer; a female operatic star,sensitive
n10093475,"first sergeant, sergeant first class",a sergeant in the Army above the rank of staff sergeant and below master sergeant,sensitive
n10078719,farm boy,a boy who has grown up on a farm,sensitive
n09728285,"Romanian, Rumanian",a native or inhabitant of Romania,sensitive
n09724234,Gurkha,a member of Hindu people descended from brahmins and Rajputs who live in Nepal,sensitive
n09738121,Igbo,"a member of the largest ethnic group in southeastern Nigeria; ""most Igbo are farmers""",sensitive
n09904208,centenarian,someone who is at least 100 years old,sensitive
n10672540,"suffragan, suffragan bishop",an assistant or subordinate bishop of a diocese,sensitive
n10756148,viscount,(in various countries) a son or younger brother or a count,sensitive
n09912995,checker,one who checks the correctness of something,sensitive
n09836343,banderillero,the bullfighter who implants decorated darts (banderillas) into the neck or shoulders of the bull during a bull fight,sensitive
