wnid,synset,gloss,safety
n10400003,paretic,a person afflicted with paresis (partial paralysis),sensitive
n09651123,Caddo,a group of Plains Indians formerly living in what is now North and South Dakota and Nebraska and Kansas and Arkansas and Louisiana and Oklahoma and Texas,sensitive
n10512372,"recruit, military recruit",a recently enlisted soldier,sensitive
n09734639,Tuareg,a member of a nomadic Berber people of the Sahara,sensitive
n10333838,"motorcycle cop, motorcycle policeman, speed cop",a policeman who rides a motorcycle (and who checks the speeds of motorists),sensitive
n09867154,borderer,an inhabitant of a border area (especially the border between Scotland and England),sensitive
n10302576,"matriarch, materfamilias",a female head of a family or tribe,sensitive
n10033412,"dressmaker, modiste, needlewoman, seamstress, sempstress",someone who makes or mends dresses,sensitive
n10467395,"President of the United States, United States President, President, Chief Executive","the person who holds the office of head of state of the United States government; ""the President likes to jog every morning""",sensitive
n10258786,licentiate,holds a license (degree) from a (European) university,sensitive
n09742101,Floridian,a native or resident of Florida,sensitive
n09707061,Livonian,a member of the Livonian-speaking people of Latvia,sensitive
n09961198,contralto,a woman singer having a contralto voice,sensitive
n10174695,"Highlander, Scottish Highlander, Highland Scot",a native of the Highlands of Scotland,sensitive
n09639382,Circassian,a member of the Sunni Muslim people living in northwestern Caucasia,sensitive
n09841188,"bartender, barman, barkeep, barkeeper, mixologist",an employee who mixes and serves alcoholic drinks at a bar,sensitive
n10355142,neutral,one who does not side with any party in a war or dispute,sensitive
n09797873,Anzac,a soldier in the Australian and New Zealand army corps during World War I,sensitive
n09845849,"beatnik, beat",a member of the beat generation; a nonconformist in dress and behavior,sensitive
n09970088,counterterrorist,someone who attempts to prevent terrorism,sensitive
n10291469,man-at-arms,a heavily armed and mounted soldier in medieval times,sensitive
n09920901,"chorus girl, showgirl, chorine",a woman who dances in a chorus line,sensitive
n10400998,"parodist, lampooner",mimics literary or musical style for comic effect,sensitive
n10543161,running back,(football) a back on the offensive team (a fullback or halfback) who tries to advance the ball by carrying it on plays from the line of scrimmage,sensitive
n09727826,Polynesian,a native or inhabitant of Polynesia,sensitive
n10727171,trawler,a fisherman who use a trawl net,sensitive
n09660240,Maricopa,a member of a North American Indian people of the Gila river valley in Arizona,sensitive
n10253122,"left-hander, lefty, southpaw","a person who uses the left hand with greater skill than the right; ""their pitcher was a southpaw""",sensitive
n09754152,abbe,a French abbot,sensitive
n09637339,Black woman,a woman who is Black,sensitive
n09748648,Prussian,a German inhabitant of Prussia,sensitive
n09954355,confessor,a priest who hears confession and gives absolution,sensitive
n10171219,"herald, trumpeter","(formal) a person who announces important news; ""the chieftain had a herald who announced his arrival with a trumpet""",sensitive
n10764719,wallah,"usually in combination: person in charge of or employed at a particular thing; ""a kitchen wallah""; ""the book wallah""",sensitive
n09779280,agonist,someone involved in a contest or battle (as in an agon),sensitive
n09764732,action officer,the case officer designated to perform an act during a clandestine operation (especially in a hostile area),sensitive
n10380126,optimist,a person disposed to take a favorable view of things,sensitive
n10266848,"litigant, litigator","(law) a party to a lawsuit; someone involved in litigation; ""plaintiffs and defendants are both litigants""",sensitive
n10145340,great grandchild,a child of your grandson or granddaughter,sensitive
n10298647,master,directs the work of others,sensitive
n09796809,anti,"a person who is opposed (to an action or policy or practice etc.); ""the antis smelled victory after a long battle""",sensitive
n09744462,"New Jerseyan, New Jerseyite, Garden Stater",a native of resident of New Jersey,sensitive
n10513823,"redhead, redheader, red-header, carrottop",someone who has red hair,sensitive
n10750640,vicar-general,(Roman Catholic Church) an administrative deputy who assists a bishop,sensitive
n10501453,"quick study, sponge","someone able to acquire new knowledge and skills rapidly and easily; ""she soaks up foreign languages like a sponge""",sensitive
n10732854,Tudor,a member of the dynasty that ruled England,sensitive
n11100798,"Kennan, George F. Kennan, George Frost Kennan",United States diplomat who recommended a policy of containment in dealing with Soviet aggression (1904-2005),sensitive
n10400108,parishioner,a member of a parish,sensitive
n10622053,soldier,"an enlisted man or woman who serves in an army; ""the soldiers stood at attention""",sensitive
n10512708,recruiter,someone who supplies members or employees,sensitive
n10782791,winner,a gambler who wins a bet,sensitive
n09902851,celebrant,an officiating priest celebrating the Eucharist,sensitive
n09675673,Toda,a member of a pastoral people living in the Nilgiri Hills of southern India,sensitive
n09923673,citizen,a native or naturalized member of a state or other political community,sensitive
n09913455,cheerleader,someone who leads the cheers by spectators at a sporting event,sensitive
n10160188,hardliner,a conservative who is uncompromising,sensitive
n09843716,batman,an orderly assigned to serve a British military officer,sensitive
n09916348,"chief executive officer, CEO, chief operating officer",the corporate executive responsible for the operations of the firm; reports to a board of directors; may appoint other managers (including a president),sensitive
n10506544,ranch hand,a hired hand on a ranch,sensitive
n10157016,halberdier,a guard who carries a halberd (as a symbol of his duty),sensitive
n10237556,"kitchen police, KP",an enlisted person who is assigned to assist the cooks,sensitive
n09679925,Catholic,a member of a Catholic church,sensitive
n09690083,Algerian,a native or inhabitant of Algeria,sensitive
n10709529,thrower,someone who projects something (especially by a rapid motion of the arm),sensitive
n09662661,"Navaho, Navajo",a member of an Athapaskan people that migrated to Arizona and New Mexico and Utah,sensitive
n10235385,Counsel to the Crown,a barrister selected to serve as counsel to the British ruler,sensitive
n09706029,Finn,a native or inhabitant of Finland,sensitive
n10407310,"patriot, nationalist",one who loves and defends his or her country,sensitive
n10130877,girlfriend,"any female friend; ""Mary and her girlfriend organized the party""",sensitive
n09933972,co-beneficiary,one of two or more beneficiaries of the same benefit,sensitive
n09648911,Aztec,a member of the Nahuatl people who established an empire in Mexico that was overthrown by Cortes in 1519,sensitive
n10460033,"potboy, potman",a worker in an inn or public house who serves customers and does various chores,sensitive
n09793946,"angler, troller",a fisherman who uses a hook and line,sensitive
n10775003,wetter,a workman who wets the work in a manufacturing process,sensitive
n10621400,sodalist,a member of a sodality,sensitive
n10502329,rabbi,spiritual leader of a Jewish congregation; qualified to expound and apply Jewish law,sensitive
n10293861,margrave,a German nobleman ranking above a count (corresponding in rank to a British marquess),sensitive
n10675609,super heavyweight,an amateur boxer who weighs more than 201 pounds,sensitive
n10338231,"Mullah, Mollah, Mulla",a Muslim trained in the doctrine and law of Islam; the head of a mosque,sensitive
n09745834,Texan,a native or resident of Texas,sensitive
n10284871,malahini,a newcomer to Hawaii,sensitive
n10320863,"minister, government minister","a person appointed to a high office in the government; ""Minister of Finance""",sensitive
n10477713,"probationer, student nurse",a nurse in training who is undergoing a trial period,sensitive
n09692125,Basotho,a member of a subgroup of people who inhabit Lesotho,sensitive
n09722064,Sabahan,a Malaysian from Sabah,sensitive
n10748142,"venturer, merchant-venturer",a merchant who undertakes a trading venture (especially a venture that sends goods overseas),sensitive
n09616922,entertainer,a person who tries to please or amuse,sensitive
n10548419,"salesgirl, saleswoman, saleslady",a woman salesperson,sensitive
n09668988,Sihasapa,a member of a group of Siouan people who constituted a division of the Teton Sioux,sensitive
n10633450,"spectator, witness, viewer, watcher, looker","a close observer; someone who looks at something (such as an exhibition of some kind); ""the spectators applauded the performance""; ""television viewers""; ""sky watchers discovered a new star""",sensitive
n10420507,"pet sitter, critter sitter",someone left in charge of pets while their owners are away from home,sensitive
n10070449,exegete,a person skilled in exegesis (especially of religious texts),sensitive
n09689958,Albanian,a native or inhabitant of Albania,sensitive
n10500419,queen consort,the wife of a reigning king,sensitive
n09673091,Yuma,a member of the North American Indian people of Arizona and adjacent Mexico and California,sensitive
n10747548,venerator,someone who regards with deep respect or reverence,sensitive
n10676018,"superior, higher-up, superordinate",one of greater rank or station or quality,sensitive
n09955406,"Confucian, Confucianist",a believer in the teachings of Confucius,sensitive
n10296176,"marshal, marshall",(in some countries) a military officer of highest rank,sensitive
n10064831,"esthetician, aesthetician",a worker skilled in giving beauty treatments (manicures and facials etc.),sensitive
n10313239,metropolitan,in the Eastern Orthodox Church this title is given to a position between bishop and patriarch; equivalent to archbishop in western Christianity,sensitive
n10425946,philosopher,a wise person who is calm and rational; someone who lives a life of reason with equanimity,sensitive
n10438172,"planner, contriver, deviser",a person who makes plans,sensitive
n10462588,power user,(computing) a computer user who needs the fastest and most powerful computers available,sensitive
n10443830,pluralist,a cleric who holds more than one benefice at a time,sensitive
n10187130,host,a person who invites guests to a social event (such as a party in his or her own home) and who is responsible for them while they are there,sensitive
n09772330,adoptee,someone (such as a child) who has been adopted,sensitive
n10386196,out-and-outer,someone who is excellent at something,sensitive
n10679503,Surgeon General,the senior medical officer in an Army or Navy,sensitive
n09894654,card player,someone who plays (or knows how to play) card games,sensitive
n09895480,career man,a man who is a careerist,sensitive
n10209082,"instigator, initiator",a person who initiates a course of action,sensitive
n10654321,"stepbrother, half-brother, half brother",a brother who has only one parent in common with you,sensitive
n09681107,"Uniat, Uniate, Uniate Christian",a member of the Uniat Church,sensitive
n10742005,usherette,a female usher,sensitive
n09967555,Cossack,a member of a Slavic people living in southern European Russia and Ukraine and adjacent parts of Asia and noted for their horsemanship and military skill; they formed an elite cavalry corps in czarist Russia,sensitive
n10561222,scion,"a descendent or heir; ""a scion of royal stock""",sensitive
n10253611,legatee,someone to whom a legacy is bequeathed,sensitive
n10403876,"passenger, rider",a traveler riding in a vehicle (a boat or bus or car or plane or train etc) who is not operating it,sensitive
n10321340,"minor leaguer, bush leaguer",a player on a minor-league baseball team,sensitive
n10289462,manageress,a woman manager,sensitive
n09657206,Hunkpapa,a member of the Siouan people who constituted a division of the Teton Sioux and who formerly lived in the western Dakotas; they were prominent in resisting the white encroachment into the northern Great Plains,sensitive
n09844457,Bavarian,a native or an inhabitant of Bavaria,sensitive
n09694664,Bolivian,a native or inhabitant of Bolivia,sensitive
n09701148,English person,a native or inhabitant of England,sensitive
n10674130,"suitor, suer, wooer","a man who courts a woman; ""a suer for the hand of the princess""",sensitive
n10574538,secularist,an advocate of secularism; someone who believes that religion should be excluded from government and education,sensitive
n10791115,working girl,a young woman who is employed,sensitive
n10716576,Tory,an American who favored the British side during the American Revolution,sensitive
n10655730,steward,the ship's officer who is in charge of provisions and dining arrangements,sensitive
n10548537,salesman,a man salesperson,sensitive
n10397392,"papoose, pappoose",an American Indian infant,sensitive
n09718217,"Japanese, Nipponese",a native or inhabitant of Japan,sensitive
n10486166,protegee,a woman protege,sensitive
n10218043,Ivy Leaguer,a student or graduate at an Ivy League school,sensitive
n10607478,skinhead,a young person who belongs to a British or American group that shave their heads and gather at rock concerts or engage in white supremacist demonstrations,sensitive
n09872557,"brahman, brahmin","a member of the highest of the four Hindu varnas; ""originally all brahmans were priests""",sensitive
n09693982,Barbadian,a native or inhabitant of Barbados,sensitive
n09650729,Biloxi,a member of the Siouan people of southeastern Mississippi,sensitive
n10277815,Lutheran,follower of Lutheranism,sensitive
n10379376,"opportunist, self-seeker",a person who places expediency above principle,sensitive
n10275249,"Lowlander, Scottish Lowlander, Lowland Scot",a native of the Lowlands of Scotland,sensitive
n09986700,Cynic,a member of a group of ancient Greek philosophers who advocated the doctrine that virtue is the only good and that the essence of virtue is self-control,sensitive
n10157271,half blood,one of siblings who have only one parent in common,sensitive
n10282672,"maid, maidservant, housemaid, amah",a female domestic,sensitive
n10667709,subaltern,a British commissioned army officer below the rank of captain,sensitive
n09680908,Old Catholic,a member of the church formed in the 19th century by German Catholics who refused to accept the infallibility of the Pope,sensitive
n10306890,"Melkite, Melchite",an eastern Christian in Egypt or Syria who adheres to the Orthodox faith as defined by the council of Chalcedon in 451 and as accepted by the Byzantine emperor,sensitive
n09675045,Kui,a member of the Dravidian people living in southeastern India,sensitive
n10731013,"Trotskyite, Trotskyist, Trot",radicals who support Trotsky's theory that socialism must be established throughout the world by continuing revolution,sensitive
n09635635,"Afrikaner, Afrikander, Boer",a white native of Cape Province who is a descendant of Dutch settlers and who speaks Afrikaans,sensitive
n10199251,"imam, imaum",(Islam) the man who leads prayers in a mosque; for Shiites an imam is a recognized authority on Islamic theology and law and a spiritual guide,sensitive
n10314054,middle-aged man,a man who is roughly between 45 and 65 years old,sensitive
n09648743,Nahuatl,a member of any of various Indian peoples of central Mexico,sensitive
n10015897,"disbeliever, nonbeliever, unbeliever",someone who refuses to believe (as in a divinity),sensitive
n10055297,"enchantress, witch",a female sorcerer or magician,sensitive
n10104888,forewoman,a woman in charge of a group of workers,sensitive
n10411867,"pederast, paederast, child molester",a man who has sex (usually sodomy) with a boy as the passive partner,sensitive
n09659039,Kickapoo,a member of the Algonquian people formerly inhabiting southern Wisconsin and northern Illinois,sensitive
n09690208,Altaic,any member of the peoples speaking a language in the Altaic language group,sensitive
n09710164,"Greek, Hellene",a native or inhabitant of Greece,sensitive
n09650839,Blackfoot,a member of a warlike group of Algonquians living in the northwestern plains,sensitive
n09704157,Lancastrian,a member (or supporter) of the house of Lancaster,sensitive
n10219240,Jane Doe,an unknown or fictitious woman who is a party to legal proceedings,sensitive
n10076483,"falangist, phalangist",a Spanish member of General Franco's political party,sensitive
n10598459,"silent partner, sleeping partner",a partner (who usually provides capital) whose association with the enterprise is not public knowledge,sensitive
n10106387,"foster-father, foster father",a man who is a foster parent,sensitive
n09663248,"Oglala, Ogalala",a member of the Siouan people who constituted a division of the Teton Sioux and who formerly inhabited the Black Hills of western South Dakota,sensitive
n10063635,"Eskimo, Esquimau, Inuit",a member of a people inhabiting the Arctic (northern Canada or Greenland or Alaska or eastern Siberia); the Algonquians called them Eskimo (`eaters of raw flesh') but they call themselves the Inuit (`the people'),sensitive
n09678747,"Adventist, Second Adventist",a member of Christian denomination that expects the imminent advent of Christ,sensitive
n10464052,"prayer, supplicant",someone who prays to God,sensitive
n09848489,"believer, truster",a supporter who accepts something as true,sensitive
n10020366,"divorcee, grass widow",a divorced woman or a woman who is separated from her husband,sensitive
n09814660,"asserter, declarer, affirmer, asseverator, avower","someone who claims to speak the truth; ""a bold asserter""; ""a declarer of his intentions""; ""affirmers of traditional doctrine""; ""an asseverator of strong convictions""; ""an avower of his own great intelligence""",sensitive
n10060175,entrant,"someone who enters; ""new entrants to the country must go though immigration procedures""",sensitive
n10111779,Freudian,a person who follows the basic theories or practices of Sigmund Freud,sensitive
n09750770,Yemeni,a native or inhabitant of Yemen,sensitive
n10697282,"teetotaler, teetotaller, teetotalist",a total abstainer,sensitive
n09693244,"Luba, Chiluba",a member of a Bantu people in southeastern Congo,sensitive
n10295479,"marquis, marquess",nobleman (in various countries) ranking above a count,sensitive
n10328437,moneymaker,someone who is successful in accumulating wealth,sensitive
n10380499,Orangeman,a member of a society founded in Ireland in 1795 to uphold Protestantism and the British sovereign,sensitive
n09670280,Taracahitian,a member of a group of peoples of Mexico,sensitive
n10636488,"spinster, old maid",an elderly unmarried woman,sensitive
n09708889,Parisienne,a female native or resident of Paris,sensitive
n10343355,myope,a person with myopia; a nearsighted person,sensitive
n10431625,"picker, chooser, selector",a person who chooses or selects out,sensitive
n10183347,honest woman,"a wife who has married a man with whom she has been living for some time (especially if she is pregnant at the time); ""he made an honest woman of her""",sensitive
n09985978,"cyborg, bionic man, bionic woman","a human being whose body has been taken over in whole or in part by electromechanical devices; ""a cyborg is a cybernetic organism""",sensitive
n10033663,"dribbler, driveller, slobberer, drooler","a person who dribbles; ""that baby is a dribbler; he needs a bib""",sensitive
n10355806,New Dealer,a supporter of the economic policies in the United States known as the New Deal,sensitive
n10243483,lady's maid,a maid who is a lady's personal attendant,sensitive
n09705671,Amhara,a member of the Semitic speaking people of northern Ethiopia,sensitive
n10668666,"subject, case, guinea pig","a person who is subjected to experimental or other observational procedures; someone who is an object of investigation; ""the subjects for this investigation were selected randomly""; ""the cases that we studied were drawn from two different communities""",sensitive
n09905530,"chachka, tsatske, tshatshke, tchotchke, tchotchkeleh","(Yiddish) an attractive, unconventional woman",sensitive
n10308504,"memorizer, memoriser",a person who learns by rote,sensitive
n09789898,analogist,someone who looks for analogies or who reasons by analogy,sensitive
n09683757,Buddhist,one who follows the teachings of Buddha,sensitive
n10368624,nymphet,a sexually attractive young woman,sensitive
n10485883,protectionist,an advocate of protectionism,sensitive
n10202225,inamorato,a man with whom you are in love or have an intimate relationship,sensitive
n10669991,"subordinate, subsidiary, underling, foot soldier",an assistant subject to the authority or control of another,sensitive
n10036444,Druid,a pre-Christian priest among the Celts of ancient Gaul and Britain and Ireland,sensitive
n10316527,"military chaplain, padre, Holy Joe, sky pilot",a chaplain in one of the military services,sensitive
n10368291,"nursling, nurseling, suckling",an infant considered in relation to its nurse,sensitive
n10289039,man,"the generic use of the word to refer to any human being; ""it was every man for himself""",sensitive
n10580030,"separatist, separationist",an advocate of secession or separation from a larger group (such as an established church or a national union),sensitive
n09987161,czar,a person having great power,sensitive
n10268629,lobbyist,someone who is employed to persuade legislators to vote for legislation that favors the lobbyist's employer,sensitive
n09928451,clerk,"an employee who performs clerical work (e.g., keeps records or accounts)",sensitive
n10628097,Southern Baptist,a member of the Southern Baptist Convention,sensitive
n09734185,Tanzanian,a native or inhabitant of Tanzania,sensitive
n10243872,"lamb, dear",a sweet innocent mild-mannered person (especially a child),sensitive
n09970822,compromiser,"a negotiator willing to compromise; ""Henry Clay was known as the Great Compromiser""",sensitive
n10704886,thane,a man ranking above an ordinary freeman and below a noble in Anglo-Saxon England (especially one who gave military service in exchange for land),sensitive
n09856827,"birth-control campaigner, birth-control reformer",a social reformer who advocates birth control and family planning,sensitive
n09721444,Macedonian,a native or inhabitant of Macedon,sensitive
n09712696,"Malay, Malayan",a member of a people inhabiting the northern Malay Peninsula and Malaysia and parts of the western Malay Archipelago,sensitive
n09696456,Cameroonian,a native or inhabitant of Cameroon,sensitive
n09725772,Pakistani,a native or inhabitant of Pakistan,sensitive
n10042845,"eccentric, eccentric person, flake, oddball, geek",a person with an unusual or odd personality,sensitive
n06340977,Hakham,a Hebrew title of respect for a wise and highly educated man,sensitive
n10382302,ordinand,a person being ordained,sensitive
n09702673,Angle,a member of a Germanic people who conquered England and merged with the Saxons and Jutes to become Anglo-Saxons,sensitive
n10131268,"Girondist, Girondin",a member of the moderate republican party that was in power during the French Revolution; the Girondists were overthrown by their more radical rivals the Jacobins,sensitive
n09750641,Walloon,a member of the French-speaking people living in Belgium,sensitive
n09650989,Brule,a member of a group of Siouan people who constituted a division of the Teton Sioux,sensitive
n09675799,Tulu,a member of a Dravidian people living on the southwestern coast of India,sensitive
n10062905,escapee,someone who escapes,sensitive
n10527334,"revolutionist, revolutionary, subversive, subverter",a radical supporter of political or social revolution,sensitive
n10308653,Mendelian,a follower of Mendelism,sensitive
n10685398,sylph,a slender graceful young woman,sensitive
n10573957,"sectarian, sectary, sectarist","a member of a sect; ""most sectarians are intolerant of the views of any other sect""",sensitive
n10111903,"friar, mendicant",a male member of a religious order that originally relied solely on alms,sensitive
n10097590,Florentine,"a native or resident of Florence, Italy",sensitive
n10700963,tenderfoot,an inexperienced person (especially someone inexperienced in outdoor living),sensitive
n10351064,necker,a lover who necks,sensitive
n09703809,Cornishman,a man who is a native or inhabitant of Cornwall,sensitive
n10705615,"theologian, theologist, theologizer, theologiser",someone who is learned in theology or who speculates about theology,sensitive
n09902128,"Cavalier, Royalist",a royalist supporter of Charles I during the English Civil War,sensitive
n10718665,"tovarich, tovarisch",a comrade (especially in Russian communism),sensitive
n10508379,raw recruit,an inexperienced and untrained recruit,sensitive
n10358575,NIMBY,someone who objects to siting something in their own neighborhood but does not object to it being sited elsewhere; an acronym for not in my backyard,sensitive
n10598181,signorina,"an Italian courtesy title for an unmarried woman; equivalent to `Miss', it is either used alone or before a name",sensitive
n10776052,Whig,a supporter of the American Revolution,sensitive
n10332953,mother,a term of address for an elderly woman,sensitive
n09950457,compulsive,a person with a compulsive disposition; someone who feels compelled to do certain things,sensitive
n10784544,witch doctor,someone who is believed to heal through magical powers,sensitive
n10242328,Labourite,a member of the British Labour Party,sensitive
n10281896,mahatma,(Hinduism) term of respect for a brahmin sage,sensitive
